Gest;sent;name;value;pos;feats;num;anim;modifier
pgb-index-nocontact-complex-down;Ну то есть PGB-index-nocontact-complex-down вот песочек PGE, PGB-index-nocontact-complex-down да, и вот эта вот стойка PGE, пальмовая крыша и неплохо так все таки у них.;w6;стойка;NOUN;Animacy=Inan|Case=Nom|Gender=Fem|Number=Sing;sg;Material;dem
pgb-index-nocontact-complex-down;Вот, и он вот, PGB-index-nocontact-complex-down под влиянием алкоголя PGE.;w3;алкоголя;NOUN;Animacy=Inan|Case=Gen|Gender=Masc|Number=Sing;sg;Material;no
pgb-index-nocontact-complex-down;PGB-index-nocontact-complex-down фляжка разбилась PGE.;w1;фляжка;NOUN;Animacy=Inan|Case=Nom|Gender=Fem|Number=Sing;sg;Material;no
pgb-index-nocontact-complex-down;PGB-index-nocontact-complex-down А жена не сделала PGE, PGB-index-nocontact-complex-down поэтому когда он вышел PGE, PGB-index-nocontact-complex-down он пошел напрямую ей морду PGE бить.;w5;морду;NOUN;Animacy=Inan|Case=Acc|Gender=Fem|Number=Sing;sg;Material;no
pgb-index-nocontact-complex-down;Как-то это PGB-index-nocontact-complex-down мы можем в единую нормальную картинку PGE сделать?;w6;картинку;NOUN;Animacy=Inan|Case=Acc|Gender=Fem|Number=Sing;sg;Material;Other
pgb-index-nocontact-complex-up;Ну PGB-index-nocontact-complex-up слушай, судя по всему это стойки PGE, стойки этими, фруктами.;w6;стойки;NOUN;Animacy=Inan|Case=Gen|Gender=Fem|Number=Sing;sg;Material;dem
pgb-index-nocontact-complex-vertical;PGB-index-nocontact-complex-vertical И одежда у него PGE такая же PGB-index-contact-simple-up как и на той картинке PGE.;w2;одежда;NOUN;Animacy=Inan|Case=Nom|Gender=Fem|Number=Sing;sg;Material;no
pgb-index-nocontact-simple-down;PGB-index-nocontact-simple-down Зато хлебушек есть PGE.;w2;хлебушек;NOUN;Animacy=Anim|Case=Gen|Gender=Masc|Number=Plur;sg;Material;no
pgb-index-nocontact-simple-down;И что PGB-index-nocontact-simple-down в тюрьме его будет избивать PGE полицейский.;w2;тюрьме;NOUN;Animacy=Inan|Case=Loc|Gender=Masc|Number=Sing;sg;Material;no
pgb-index-nocontact-simple-down;Да, наверное, и PGB-index-contact-simple-down вот это этот мальчик PGE PGB-index-nocontact-simple-down с первой фотографии PGE, PGB-index-nocontact-simple-down это его папа с первой фотографии PGE, вот.;w6;фотографии;NOUN;Animacy=Inan|Case=Loc|Gender=Neut|Number=Sing;sg;Material;Other
pgb-index-nocontact-simple-down;PGB-index-nocontact-simple-down А это тот самый дед с первой картинки PGE.;w8;картинки;NOUN;Animacy=Inan|Case=Gen|Gender=Fem|Number=Sing;sg;Material;other
pgb-index-nocontact-simple-vertical;И, собственно, покрышка есть. я говорю, PGB-index-nocontact-complex-down у него больше, чем у меня PGE PGB-index-nocontact-simple-down было, пока PGE PGB-index-nocontact-simple-vertical в общежитии тут PGE жил.;w2;общежитии;NOUN;Animacy=Inan|Case=Loc|Gender=Neut|Number=Sing;sg;Material;no
pgb-other-contact-simple-up;Эм, ну PGB-other-contact-simple-up тут понятно, что он недоволен, потому что у него рука PGE в кулак сжата.;w10;рука;NOUN;Animacy=Inan|Case=Gen|Gender=Masc|Number=Sing;sg;Material;pp
pgb-other-contact-simple-vertical;Да, тут PGB-other-contact-simple-vertical такой второй подбородок PGE явно уже намечается.;w3;подбородок;NOUN;Animacy=Inan|Case=Gen|Gender=Fem|Number=Plur;sg;Material;dem
pgb-other-nocontact-complex-vertical;Но как бы PGB-other-nocontact-complex-vertical у него нет ни злость на лице PGE, а какой-то типа.;w7;лице;NOUN;Animacy=Inan|Case=Loc|Gender=Fem|Number=Sing;sg;Material;no
pgb-other-nocontact-simple-down;И вот томно улыбался бы, если PGB-other-nocontact-simple-down бы мне выдавали бы одежду PGE.;w5;одежду;NOUN;Animacy=Inan|Case=Acc|Gender=Fem|Number=Sing;sg;Material;no
pgb-palm-contact-complex-down;Ну понятно, да, подобрали PGE. PGB-palm-contact-complex-down И он отсидел в обезъяннике PGE ночь.;w5;обезъяннике;NOUN;Animacy=Inan|Case=Loc|Gender=Masc|Number=Sing;sg;Material;no
pgb-palm-contact-complex-down;Потом они PGB-palm-contact-complex-down связались посольством PGE, да, все хорошо.;w2;посольством;NOUN;Animacy=Inan|Case=Ins|Gender=Neut|Number=Sing;sg;Material;no
pgb-palm-contact-simple-down;Это PGB-index-contact-simple-down какая-то лавка PGE.;w2;лавка;NOUN;Animacy=Inan|Case=Nom|Gender=Fem|Number=Sing;sg;Material;indef
pgb-palm-contact-simple-down;Что это PGE если PGB-palm-contact-simple-down он вышел из тюрьмы PGE. PGB-other-contact-simple-down А это он отсидел PGE.;w4;тюрьмы;NOUN;Animacy=Inan|Case=Gen|Gender=Fem|Number=Sing;sg;Material;no
pgb-palm-contact-simple-up;PGB-index-contact-simple-down Ну PGE, у него PGB-palm-contact-simple-up есть еда PGE.;w2;еда;NOUN;Animacy=Inan|Case=Nom|Gender=Fem|Number=Sing;sg;Material;No
pgb-palm-nocontact-complex-vertical;PGB-palm-nocontact-simple-vertical Найти себе девушку PGE, PGB-palm-nocontact-complex-vertical избить ее, в тюрьму сесть PGE.;w4;тюрьму;NOUN;Animacy=Inan|Case=Acc|Gender=Fem|Number=Sing;sg;Material;no
pgb-palm-nocontact-simple-down;То есть, жена должна была его вытащить PGB-palm-nocontact-simple-down из тюрьмы PGE каким-то образом.;w2;тюрьмы;NOUN;Animacy=Inan|Case=Gen|Gender=Fem|Number=Sing;sg;Material;no
