Gest;sent;name;value;pos;feats;num;anim;modifier
pgb-index-contact-complex-down;PGB-index-contact-simple-down Ну а дед в позиции готовой PGE защищать, если честно.;w5;позиции;NOUN;Animacy=Inan|Case=Loc|Gender=Fem|Number=Sing;pl;abstract;no
pgb-index-nocontact-complex-down;Ну в общем PGB-index-nocontact-simple-down они дают показания PGE.;w3;показания;NOUN;Animacy=Inan|Case=Nom|Gender=Neut|Number=Plur;pl;abstract;no
pgb-palm-nocontact-complex-down;Потом, почему-то PGB-index-contact-simple-down мне кажется, что вот этот вот парень PGE вообще не имеет PGB-index-nocontact-complex-down отношения к ним PGE.;w1;отношения;NOUN;Animacy=Inan|Case=Nom|Gender=Neut|Number=Plur;pl;abstract;no
pgb-palm-nocontact-complex-vertical;Ну нормальные PGB-palm-nocontact-simple-vertical реалии PGE жизни человека.;w1;реалии;NOUN;Animacy=Inan|Case=Gen|Gender=Fem|Number=Sing;pl;abstract;no
pgb-palm-nocontact-complex-vertical;PGB-index-nocontact-simple-vertical Потому что тут видно, что он был недоволен тем, что ему рассказали PGE. PGB-palm-nocontact-simple-vertical А тут он как бы я вижу последствия PGE.;w8;последствия;NOUN;Animacy=Inan|Case=Nom|Gender=Fem|Number=Sing;pl;abstract;no
pgb-palm-nocontact-simple-vertical;Ну PGB-palm-nocontact-simple-vertical хотя бы он PGB-palm-nocontact-complex-down не вижу тут ни нотки раскаяние нигде PGE.;w9;нотки;NOUN;Animacy=Inan|Case=Nom|Gender=Fem|Number=Plur;pl;abstract;no
pgb-index-contact-complex-down;Ну смотри не, PGB-index-contact-complex-down из камеры свет то светит PGE.;w3;свет;NOUN;Animacy=Inan|Case=Acc|Gender=Masc|Number=Sing;sg;abstract;no
pgb-index-contact-complex-down;PGB-index-contact-complex-down Ну то есть, тут то явно прошло как минимум PGE несколько лет, да? Да.;w9;минимум;NOUN;Animacy=Inan|Case=Acc|Gender=Masc|Number=Sing;sg;abstract;no
pgb-index-contact-complex-down;PGB-index-contact-simple-down В ярости PGE PGB-index-contact-complex-down ты имеешь в виду PGE мужчина, PGB-index-nocontact-simple-down не дедушка PGE? PGB-index-nocontact-simple-down Да, да, да PGE.;w4;виду;NOUN;Animacy=Inan|Case=Loc|Gender=Masc|Number=Sing;sg;abstract;no
pgb-index-contact-simple-down;PGB-index-contact-simple-down Это на самом деле нифига не раскаивается PGE.;w4;деле;NOUN;Animacy=Inan|Case=Loc|Gender=Neut|Number=Sing;sg;abstract;dem
pgb-index-contact-simple-down;Это он PGB-index-contact-simple-down пришел домой с пьянки PGE.;w4;пьянки;NOUN;Animacy=Inan|Case=Gen|Gender=Fem|Number=Sing;sg;abstract;no
pgb-index-contact-simple-down;PGB-index-contact-simple-down Это продолжение PGE.;w2;продолжение;NOUN;Animacy=Inan|Case=Nom|Gender=Neut|Number=Sing;sg;abstract;no
pgb-index-contact-simple-down;PGB-index-contact-simple-down В ярости PGE PGB-index-contact-complex-down ты имеешь в виду PGE мужчина, PGB-index-nocontact-simple-down не дедушка PGE? PGB-index-nocontact-simple-down Да, да, да PGE.;w2;ярости;NOUN;Animacy=Inan|Case=Gen|Gender=Fem|Number=Sing;sg;abstract;no
pgb-index-contact-simple-down;PGB-index-contact-simple-down И рассказывает ему историю их знакомства PGE и PGB-index-contact-simple-down ему что-то не нравится PGE.;w6;знакомства;NOUN;Animacy=Inan|Case=Gen|Gender=Neut|Number=Sing;sg;abstract;pp
pgb-index-nocontact-complex-down;Хотя PGB-index-contact-complex-down жена то тоже явно PGE, вот то, PGB-index-nocontact-simple-vertical что мы в самом начале сказали PGE, да, PGB-index-nocontact-complex-down что она явно PGE PGB-index-nocontact-complex-down Никто на самом деле не счастлив PGE его видеть то по началу.;w4;деле;NOUN;Animacy=Inan|Case=Loc|Gender=Neut|Number=Sing;sg;abstract;dem
pgb-index-nocontact-simple-down;Там просто такой ракурс. PGB-index-nocontact-simple-down Это просто ракурс PGE такой.;w3;ракурс;NOUN;Animacy=Inan|Case=Nom|Gender=Masc|Number=Sing;sg;abstract;dem
pgb-index-nocontact-simple-down;Там PGB-index-nocontact-simple-down целая такая пачка PGE.;w3;пачка;NOUN;Animacy=Inan|Case=Nom|Gender=Fem|Number=Sing;sg;abstract;dem
pgb-index-nocontact-simple-down;Ну почти PGB-index-nocontact-simple-down уверен, что история идет в обратную сторону PGE.;w3;история;NOUN;Animacy=Inan|Case=Nom|Gender=Fem|Number=Sing;sg;abstract;no
pgb-index-nocontact-simple-down;Ну почти PGB-index-nocontact-simple-down уверен, что история идет в обратную сторону PGE.;w7;сторону;NOUN;Animacy=Inan|Case=Acc|Gender=Fem|Number=Sing;sg;abstract;other
pgb-index-nocontact-simple-up;Опять же, PGB-index-nocontact-simple-up лучше чем большинство PGE студентов.;w3;большинство;NOUN;Animacy=Inan|Case=Nom|Gender=Neut|Number=Sing;sg;abstract;no
pgb-index-nocontact-simple-vertical;Хотя PGB-index-contact-complex-down жена то тоже явно PGE, вот то, PGB-index-nocontact-simple-vertical что мы в самом начале сказали PGE, да, PGB-index-nocontact-complex-down что она явно PGE PGB-index-nocontact-complex-down Никто на самом деле не счастлив PGE его видеть то по началу.;w5;начале;NOUN;Animacy=Inan|Case=Loc|Gender=Neut|Number=Sing;sg;abstract;dem
pgb-index-nocontact-simple-vertical;PGB-index-nocontact-simple-vertical В общем PGE, не знаю, я тут вообще не вижу никакого судьи, наверное, PGB-index-nocontact-simple-down досудебное.;w2;общем;NOUN;Animacy=Inan|Case=Loc|Gender=Neut|Number=Sing;sg;abstract;Other
pgb-index-nocontact-simple-vertical;Это, PGB-index-nocontact-simple-vertical наверное, первый момент PGE когда он вышел.;w3;момент;NOUN;Animacy=Inan|Case=Acc|Gender=Masc|Number=Sing;sg;abstract;other
pgb-other-contact-simple-down;Ну да, PGB-other-contact-simple-down он стоит тут PGE. PGB-other-contact-simple-down Там вроде как свобода PGE.;w4;свобода;NOUN;Animacy=Inan|Case=Nom|Gender=Fem|Number=Sing;sg;abstract;No
pgb-other-contact-simple-up;PGB-other-contact-simple-up Вот это его там кусок хлеба, который ему дали PGE.;w5;кусок;NOUN;Animacy=Inan|Case=Acc|Gender=Masc|Number=Sing;sg;abstract;dem
pgb-other-nocontact-complex-vertical;Но как бы PGB-other-nocontact-complex-vertical у него нет ни злость на лице PGE, а какой-то типа.;w5;злость;NOUN;Animacy=Inan|Case=Nom|Gender=Fem|Number=Sing;sg;abstract;no
pgb-palm-contact-complex-down;Вот, теперь PGB-palm-contact-complex-down на самом деле мне интересно, что же у него PGE вызвало такой гнев. А.;w3;деле;NOUN;Animacy=Inan|Case=Loc|Gender=Neut|Number=Sing;sg;abstract;dem
pgb-palm-contact-complex-down;То есть PGE PGB-index-contact-simple-down и PGE PGB-index-contact-complex-down собственно вопрос в том, что PGE, похоже, PGB-index-contact-simple-down ему выдают эти вещи сейчас PGE.;w2;вопрос;NOUN;Animacy=Inan|Case=Nom|Gender=Masc|Number=Sing;sg;abstract;no
pgb-palm-contact-complex-vertical;Мы не знаем кто это. PGB-palm-contact-simple-vertical Да, в общем он пришел домой после PGE PGB-palm-contact-complex-vertical того как ему на пьянке рассказали PGE, PGB-palm-nocontact-complex-vertical что видели его жену PGE. PGB-palm-nocontact-complex-vertical Что она с кем-то общалась PGE. PGB-palm-contact-simple-vertical Очень дружелюбно.;w5;пьянке;NOUN;Animacy=Inan|Case=Loc|Gender=Fem|Number=Sing;sg;abstract;no
pgb-palm-contact-simple-down;PGB-index-contact-simple-down И рассказывает ему историю их знакомства PGE и PGB-index-contact-simple-down ему что-то не нравится PGE.;w4;историю;NOUN;Animacy=Inan|Case=Acc|Gender=Fem|Number=Sing;sg;abstract;No
pgb-palm-contact-simple-down;Там PGB-index-contact-simple-down у него было отрицание PGE.;w4;отрицание;NOUN;Animacy=Inan|Case=Nom|Gender=Neut|Number=Sing;sg;abstract;no
pgb-palm-contact-simple-down;Правда это, не правда, не важно. PGB-other-nocontact-complex-up Но этот PGE PGB-other-contact-simple-down человек под влиянием PGE алкоголя.;w3;влиянием;NOUN;Animacy=Inan|Case=Ins|Gender=Neut|Number=Sing;sg;abstract;no
pgb-palm-contact-simple-down;То есть это, PGB-palm-contact-simple-down ожидание - реальность PGE как бы. PGB-palm-nocontact-simple-vertical То есть как бы PGE.;w1;ожидание;NOUN;Animacy=Inan|Case=Nom|Gender=Neut|Number=Sing;sg;abstract;no
pgb-palm-contact-simple-down;То есть это, PGB-palm-contact-simple-down ожидание - реальность PGE как бы. PGB-palm-nocontact-simple-vertical То есть как бы PGE.;w3;реальность;NOUN;Animacy=Inan|Case=Nom|Gender=Fem|Number=Sing;sg;abstract;no
pgb-palm-contact-simple-down;PGB-index-contact-simple-down Дедушка в шоке PGE.;w3;шоке;NOUN;Animacy=Inan|Case=Loc|Gender=Fem|Number=Sing;sg;abstract;no
pgb-palm-contact-simple-down;Нет, PGB-index-contact-simple-down тут к сожалению PGE, тут не.;w3;сожалению;NOUN;Animacy=Inan|Case=Dat|Gender=Neut|Number=Sing;sg;abstract;no
pgb-palm-contact-simple-down;Окей, у меня PGB-index-contact-simple-down предположение одно PGE, что это, PGB-index-contact-simple-down что это что он PGE говорит, что PGB-index-contact-simple-down это его девушка PGE.;w1;предположение;NOUN;Animacy=Inan|Case=Nom|Gender=Neut|Number=Sing;sg;abstract;other
pgb-palm-contact-simple-down;Все, счастливую PGB-palm-contact-simple-down историю делаем PGE?;w1;историю;NOUN;Animacy=Inan|Case=Acc|Gender=Fem|Number=Sing;sg;abstract;other
pgb-palm-contact-simple-vertical;Но в общем, PGB-index-contact-simple-vertical это действительно какая-то тропическая страна PGE.;w5;страна;NOUN;Animacy=Inan|Case=Nom|Gender=Fem|Number=Sing;sg;abstract;Indef
pgb-palm-contact-simple-vertical;Мы не знаем кто это. PGB-palm-contact-simple-vertical Да, в общем он пришел домой после PGE PGB-palm-contact-complex-vertical того как ему на пьянке рассказали PGE, PGB-palm-nocontact-complex-vertical что видели его жену PGE. PGB-palm-nocontact-complex-vertical Что она с кем-то общалась PGE. PGB-palm-contact-simple-vertical Очень дружелюбно.;w3;общем;NOUN;Animacy=Inan|Case=Loc|Gender=Neut|Number=Sing;sg;abstract;other
pgb-palm-nocontact-complex-down;И так понимаю, что он PGB-palm-nocontact-simple-down не доволен PGE вот этой PGB-palm-nocontact-complex-down вот этим общением PGE PGB-palm-nocontact-complex-down между мужчиной и женщиной PGE.;w3;общением;NOUN;Animacy=Inan|Case=Ins|Gender=Neut|Number=Sing;sg;abstract;dem
pgb-palm-nocontact-complex-down;Вот, и он вот, PGB-index-nocontact-complex-down под влиянием алкоголя PGE.;w2;влиянием;NOUN;Animacy=Inan|Case=Ins|Gender=Neut|Number=Sing;sg;abstract;no
pgb-palm-nocontact-complex-down;А PGB-palm-nocontact-complex-down те в принципе особо PGE не.;w3;принципе;NOUN;Animacy=Inan|Case=Loc|Gender=Fem|Number=Sing;sg;abstract;no
pgb-palm-nocontact-complex-up;Но PGB-index-nocontact-complex-up мальчик на них смотрит с презрением PGE.;w6;презрением;NOUN;Animacy=Inan|Case=Ins|Gender=Neut|Number=Sing;sg;abstract;no
pgb-palm-nocontact-complex-vertical;PGB-index-nocontact-simple-down Ну смотри, у него PGE PGB-index-nocontact-complex-vertical с одной стороны покорное PGE выражение лица, но с другой стороны скажем так, такая сдавленная улыбка.;w3;стороны;NOUN;Animacy=Inan|Case=Gen|Gender=Fem|Number=Sing;sg;abstract;Other
pgb-palm-nocontact-simple-down;Ну это PGB-palm-nocontact-simple-down стандартная ситуация PGE, да, то есть, если меня там нет, значит им плохо.;w2;ситуация;NOUN;Animacy=Inan|Case=Nom|Gender=Fem|Number=Sing;sg;abstract;dem
pgb-palm-nocontact-simple-vertical;Ну PGB-palm-nocontact-simple-vertical хотя бы он PGB-palm-nocontact-complex-down не вижу тут ни нотки раскаяние нигде PGE.;w10;раскаяние;NOUN;Animacy=Inan|Case=Nom|Gender=Neut|Number=Sing;sg;abstract;no
pgb-palm-nocontact-simple-vertical;Ну в смысле, что PGB-palm-nocontact-simple-vertical это по прошествии времени PGE.;w3;прошествии;NOUN;Animacy=Inan|Case=Dat|Gender=Fem|Number=Sing;sg;abstract;no
pgb-palm-nocontact-simple-vertical;Ну в смысле, что PGB-palm-nocontact-simple-vertical это по прошествии времени PGE.;w4;времени;NOUN;Animacy=Inan|Case=Gen|Gender=Neut|Number=Sing;sg;abstract;no
pgb-index-contact-simple-down;PGB-index-nocontact-simple-down Что либо это PGE PGB его отец PGE, PGB-index-contact-simple-down который рассказывает ему PGB, как PGB-index-contact-complex-down они познакомились с его мамой PGE.;w11;мамой;NOUN;Animacy=Anim|Case=Ins|Gender=Fem|Number=Sing;sg;Anim;Pp
pgb-index-contact-complex-down;PGB-index-contact-complex-down И его вот эти друганы PGE его зовут.;w5;друганы;NOUN;Animacy=Inan|Case=Nom|Gender=Masc|Number=Plur;pl;Anim;dem
pgb-index-contact-complex-down;Да. PGB-index-contact-complex-down Даже видно эти пальмы PGE эти.;w4;пальмы;NOUN;Animacy=Anim|Case=Nom|Gender=Fem|Number=Plur;pl;anim;dem
pgb-index-contact-complex-down;И PGB-index-contact-complex-down родители явно не PGE довольны.;w1;родители;NOUN;Animacy=Anim|Case=Nom|Gender=Masc|Number=Plur;pl;Anim;No
pgb-index-nocontact-complex-down;И PGB-index-nocontact-complex-down он не хочет уже с этими людьми вообще PGE ничего иметь общего.;w7;людьми;NOUN;Animacy=Anim|Case=Ins|Gender=Masc|Number=Plur;pl;anim;dem
pgb-index-nocontact-simple-vertical;"Это тот самый мальчик? А, PGB-index-nocontact-simple-vertical эти друганы PGE! ""Пойдем ко мне!"" Мне кажется на островах это ну типа нормально, что ты алкоголик.";w2;друганы;NOUN;Animacy=Inan|Case=Nom|Gender=Masc|Number=Plur;pl;Anim;dem
pgb-index-contact-simple-down;Нет, тут PGB-index-contact-simple-down смотри, вот этот PGE PGB-index-contact-complex-down чувак ему говорит о том, что PGE PGB-index-contact-simple-down он якобы там PGE, PGB-index-nocontact-complex-down что эта девушка PGE.;w1;чувак;NOUN;Animacy=Inan|Case=Acc|Gender=Masc|Number=Sing;sg;anim;dem
pgb-index-contact-simple-down;PGB-index-contact-simple-down А, вот дед PGE PGB-index-contact-complex-down скорее всего это отец PGE, наверное.;w4;отец;NOUN;Animacy=Anim|Case=Nom|Gender=Masc|Number=Sing;sg;anim;dem
pgb-index-contact-simple-down;PGB-index-contact-complex-down И сын смотрит PGE PGB-index-contact-complex-down на это все тоже как-бы PGE.;w2;сын;NOUN;Animacy=Anim|Case=Nom|Gender=Masc|Number=Sing;sg;anim;no
pgb-index-contact-complex-down;PGB-index-contact-complex-down Мама мальчика PGE.;w1;мама;NOUN;Animacy=Inan|Case=Gen|Gender=Masc|Number=Sing;sg;Anim;no
pgb-index-contact-simple-down;PGB-index-contact-complex-down Мама мальчика PGE.;w2;мальчика;NOUN;Animacy=Anim|Case=Gen|Gender=Masc|Number=Sing;sg;anim;no
pgb-index-contact-simple-down;Это PGB-index-contact-complex-down скорее всего отец PGE, отец девушки либо PGB-index-nocontact-complex-down отец PGE парня.;w3;отец;NOUN;Animacy=Anim|Case=Nom|Gender=Masc|Number=Sing;sg;anim;no
pgb-index-contact-complex-down;Хотя PGB-index-contact-complex-down жена то тоже явно PGE, вот то, PGB-index-nocontact-simple-vertical что мы в самом начале сказали PGE, да, PGB-index-nocontact-complex-down что она явно PGE PGB-index-nocontact-complex-down Никто на самом деле не счастлив PGE его видеть то по началу.;w1;жена;NOUN;Animacy=Anim|Case=Nom|Gender=Fem|Number=Sing;sg;anim;no
pgb-index-contact-simple-down;Ну PGB-index-contact-complex-down тут ребенок PGE все портит.;w2;ребенок;NOUN;Animacy=Anim|Case=Nom|Gender=Masc|Number=Sing;sg;anim;no
pgb-index-contact-complex-down;То есть PGB-index-contact-complex-down он говорит, что ему, наверное, товарищ PGE рассказал, что PGB-index-contact-simple-down она флиртовала PGE PGB-index-nocontact-simple-down каким-то парнем PGE, продающим газеты.;w6;товарищ;NOUN;Animacy=Inan|Case=Gen|Gender=Neut|Number=Plur;sg;Anim;no
pgb-index-contact-simple-down;Я PGB-index-contact-complex-down так понимаю, что это один человек PGE.;w6;человек;NOUN;Animacy=Anim|Case=Nom|Gender=Masc|Number=Sing;sg;anim;other
pgb-index-contact-complex-down;PGB-index-contact-complex-down Это его это его сын PGE.;w5;сын;NOUN;Animacy=Anim|Case=Nom|Gender=Masc|Number=Sing;sg;anim;pp
pgb-index-contact-complex-down;PGB-index-contact-complex-down Может это его девушка PGE.;w4;девушка;NOUN;Animacy=Anim|Case=Nom|Gender=Fem|Number=Sing;sg;anim;pp
pgb-index-contact-complex-vertical;Хотя PGB-index-contact-complex-vertical ребенок мог как бы с ним PGE вместе прийти, да, и там встать в сторону, ждать, что- что мама с дедом сделает.;w1;ребенок;NOUN;Animacy=Anim|Case=Nom|Gender=Masc|Number=Sing;sg;anim;no
pgb-index-contact-simple-down;А, PGB-index-contact-simple-down это PGE PGB-index-contact-simple-down та же самая девушка PGE.;w4;девушка;NOUN;Animacy=Anim|Case=Nom|Gender=Fem|Number=Sing;sg;anim;dem
pgb-index-contact-simple-down;PGB-index-contact-simple-down И это этот парень PGE который, PGB-index-contact-simple-down наверное, в тюрьму и попал PGE за то, что PGB-iindex-contact-complex-down он избил ее PGE.;w4;парень;NOUN;Animacy=Inan|Case=Acc|Gender=Masc|Number=Sing;sg;Anim;dem
pgb-index-contact-simple-down;Окей, у меня PGB-index-contact-simple-down предположение одно PGE, что это, PGB-index-contact-simple-down что это что он PGE говорит, что PGB-index-contact-simple-down это его девушка PGE.;w3;девушка;NOUN;Animacy=Anim|Case=Nom|Gender=Fem|Number=Sing;sg;anim;dem
pgb-index-contact-simple-down;Эм. PGB-index-nocontact-simple-down Этот больше похож не на брата, а на отца PGE PGB-index-contact-simple-down вот этого мальчика PGE.;w3;мальчика;NOUN;Animacy=Anim|Case=Gen|Gender=Masc|Number=Sing;sg;anim;dem
pgb-index-contact-simple-down;Да, наверное, и PGB-index-contact-simple-down вот это этот мальчик PGE PGB-index-nocontact-simple-down с первой фотографии PGE, PGB-index-nocontact-simple-down это его папа с первой фотографии PGE, вот.;w4;мальчик;NOUN;Animacy=Anim|Case=Nom|Gender=Masc|Number=Sing;sg;anim;dem
pgb-index-contact-simple-down;PGB-index-contact-simple-down Это посмотри PGE, PGB-index-contact-simple-down это тот же мужик PGE.;w4;мужик;NOUN;Animacy=Anim|Case=Nom|Gender=Masc|Number=Sing;sg;anim;dem
pgb-index-contact-simple-down;PGB-index-contact-simple-down А вот этой женщины уже нету PGE. PGB-index-contact-simple-down А нет, это PGE.;w4;женщины;NOUN;Animacy=Anim|Case=Gen|Gender=Fem|Number=Sing;sg;anim;dem
pgb-index-contact-simple-down;PGB-index-contact-simple-down То есть вот это дед PGE, PGB-index-nocontact-simple-down а это PGE, PGB-index-nocontact-complex-down ну, жена PGE.;w5;дед;NOUN;Animacy=Inan|Case=Acc|Gender=Masc|Number=Sing;sg;Anim;dem
pgb-index-contact-simple-down;Это другой ребенок а это от а это PGB-index-contact-simple-down уже от этого мужика PGE.;w4;мужика;NOUN;Animacy=Inan|Case=Gen|Gender=Masc|Number=Sing;sg;anim;dem
pgb-index-contact-simple-down;Потом, почему-то PGB-index-contact-simple-down мне кажется, что вот этот вот парень PGE вообще не имеет PGB-index-nocontact-complex-down отношения к ним PGE.;w7;парень;NOUN;Animacy=Inan|Case=Acc|Gender=Masc|Number=Sing;sg;Anim;dem
pgb-index-contact-simple-down;PGB-index-contact-simple-down А, вот дед PGE PGB-index-contact-complex-down скорее всего это отец PGE, наверное.;w3;дед;NOUN;Animacy=Inan|Case=Acc|Gender=Masc|Number=Sing;sg;anim;dem
pgb-index-contact-simple-down;Да. PGB-index-contact-simple-down Ну мальчик PGE явно не слишком доверчиво слушает.;w2;мальчик;NOUN;Animacy=Anim|Case=Nom|Gender=Masc|Number=Sing;sg;anim;no
pgb-index-contact-simple-down;Угу. PGB-other-nocontact-simple-down А можно PGE? PGB-index-contact-simple-down Это наверное мама PGE.;w3;мама;NOUN;Animacy=Inan|Case=Gen|Gender=Masc|Number=Sing;sg;Anim;no
pgb-index-contact-simple-down;PGB-index-contact-simple-down Мальчик PGE грустный.;w1;мальчик;NOUN;Animacy=Anim|Case=Nom|Gender=Masc|Number=Sing;sg;anim;no
pgb-index-contact-simple-down;PGB-index-contact-simple-down Ну а дед в позиции готовой PGE защищать, если честно.;w3;дед;NOUN;Animacy=Inan|Case=Acc|Gender=Masc|Number=Sing;sg;Anim;no
pgb-index-contact-simple-down;PGB-index-contact-simple-down Мальчик подрос PGE.;w1;мальчик;NOUN;Animacy=Anim|Case=Nom|Gender=Masc|Number=Sing;sg;anim;no
pgb-index-contact-simple-down;PGB-index-contact-complex-down А вот смотри, турист тоже PGE, да. PGB-index-contact-simple-down Да, это PGE короче, PGB-index-contact-complex-down турист договорился PGE.;w4;турист;NOUN;Animacy=Anim|Case=Nom|Gender=Masc|Number=Sing;sg;anim;no
pgb-index-contact-simple-down;PGB-index-contact-complex-down А вот смотри, турист тоже PGE, да. PGB-index-contact-simple-down Да, это PGE короче, PGB-index-contact-complex-down турист договорился PGE.;w1;турист;NOUN;Animacy=Anim|Case=Nom|Gender=Masc|Number=Sing;sg;anim;no
pgb-index-contact-simple-down;Эм, вот. PGB-index-contact-simple-down Короче девушка PGE PGB-other-contact-complex-down пришла в полицию.;w2;девушка;NOUN;Animacy=Anim|Case=Nom|Gender=Fem|Number=Sing;sg;anim;no
pgb-index-contact-simple-down;PGB-index-contact-simple-down А дедушка так PGE сердит, палочку зажимает, бровки хмурит.;w2;дедушка;NOUN;Animacy=Anim|Case=Nom|Gender=Fem|Number=Sing;sg;anim;no
pgb-index-contact-simple-down;PGB-index-contact-simple-down Мужчина PGE.;w1;мужчина;NOUN;Animacy=Anim|Case=Nom|Gender=Masc|Number=Sing;sg;anim;no
pgb-index-contact-simple-down;PGB-index-contact-simple-down Дедушка в шоке PGE.;w1;дедушка;NOUN;Animacy=Anim|Case=Nom|Gender=Fem|Number=Sing;sg;anim;no
pgb-index-contact-simple-down;Та PGB-index-contact-simple-down женщина, которую PGE PGB-index-contact-simple-down ударили и мужчина PGE, который ее побил.;w3;мужчина;NOUN;Animacy=Anim|Case=Nom|Gender=Masc|Number=Sing;sg;anim;other
pgb-index-contact-simple-down;Либо PGB-palm-nocontact-simple-vertical это его друг PGE, PGB-index-contact-complex-down который рассказывает этому PGE парню о том, что PGB-index-contact-simple-down он видел его девушку PGE флиртующей PGB-index-contact-complex-down с другими PGE. PGB-other-nocontact-simple-down И он PGE весь такой, ярость, ярость.;w4;девушку;NOUN;Animacy=Anim|Case=Acc|Gender=Fem|Number=Sing;sg;anim;pp
